[
  {
    "attempt": 1,
    "blocking_issues": [
      {
        "severity": "high",
        "issue": "The conversion the story exists for was not performed. The story's task list requires each input reader to be converted to a workflow it builds for itself, and the technical plan names roughly twenty-five modules under tests/ for the tester, starting explicitly with tests/test_self_routing_retry.py and tests/test_retry_routing.py -- 'the two the evidence names'. Exactly one module was converted: tests/test_story_coordinator.py (the only test module besides conftest.py, test_baseline_honesty.py and the new configuration module that `git diff --stat` shows touched, and one of only two non-infrastructure modules that references build_workflow). tests/test_self_routing_retry.py:108 and tests/test_retry_routing.py:73 still read `conftest.shipped_workflow(REPO_ROOT, \"story-workflow\")` at module scope and are unmodified in this run's diff, so the coupling the story's measured evidence names -- a max_self_routes grant reddening four assertions in a module with nothing to say about it -- is still present in exactly the module where it was measured.",
        "location": "tests/test_self_routing_retry.py:108, tests/test_retry_routing.py:73, and the ~23 further modules named in technical_plan.likely_file_changes with stage: tester",
        "required_behavior": "Each module the plan classifies as an input reader is converted to a workflow it builds through conftest.build_workflow / materialize_workflow, keeping every assertion's subject and strength, or -- where a module genuinely is a subject reader -- the classification is stated against the specific read that keeps it there and reconciled with the plan's contrary reason for that module."
      },
      {
        "severity": "high",
        "issue": "The stated reasons on PERMITTED_LIVE_ARTIFACT_READERS do not hold against the reads they justify, so the classification is not verifiable by reading the reason against the module -- which verification_requirements names as the check. For test_self_routing_retry.py the reason is 'reads the shipped self-route schema, the shipped rules and the shipped prompts a self-routed stage is rendered from' and for test_retry_routing.py 'reads the shipped rules, the shipped verifier prompt ... and the shipped schema a verdict must satisfy'. Neither mentions the module-scope shipped-workflow read each actually carries, and in both modules that read is used as a mutable base (`json.loads(json.dumps(WORKFLOW))` at test_retry_routing.py:275,782,786 and test_self_routing_retry.py:326) -- the textbook input use the story defines. The same applies to test_stage_output_ownership.py, whose reason ('which stage of this deployment is restricted from creating what, and that only one is') describes a configuration assertion the plan says belongs in the configuration module, while the module keeps six shipped-workflow reads (lines 44, 140, 235, 357, 382, 472) driving ownership enforcement. As written, the reasons would justify keeping every module on the list, which makes the classification unfalsifiable.",
        "location": "tests/test_baseline_honesty.py:2170-2260",
        "required_behavior": "Each reason names the specific read that keeps its module on the list and is true of that module's actual reads; a module whose shipped-workflow read is used as an input is converted rather than justified, and a configuration assertion that survives in such a module moves to tests/test_shipped_workflow_is_valid.py."
      },
      {
        "severity": "medium",
        "issue": "The 'after' wall-clock runtime was not measured, so the story's final acceptance criterion is unmet. The 'before' figure is on the record (2449 tests, 474.49 s / 7:54.84 wall at dcda75d, implementation-summary.md). test-results.json records 2479 passing tests and no duration, and no other run artifact in .harness/runs/story-048/ carries one. The documentation report states the gap rather than concealing it, which is the honest handling, but the criterion asks for two measurements and only one exists.",
        "location": ".harness/runs/story-048/test-results.json",
        "required_behavior": "The tester runs the full suite and records the measured wall-clock time after the conversion alongside the before figure, so the comparison is a measurement rather than an estimate."
      }
    ],
    "retry_stage": "tester",
    "archive_directory": "attempts/attempt-1",
    "guidance": {
      "current_focus": [
        "Convert tests/test_self_routing_retry.py and tests/test_retry_routing.py to workflows they build through conftest.build_workflow and conftest.materialize_workflow. These are the two modules the story's own evidence names, and both currently take the shipped definition at module scope and mutate a deep copy of it, which is the input use the story defines.",
        "Work down the remaining modules technical_plan.likely_file_changes assigns to the tester, converting each input reader one module at a time and keeping every assertion's subject and strength unchanged.",
        "For any module kept on PERMITTED_LIVE_ARTIFACT_READERS, make the stated reason name the specific read that keeps it there and check it against the module's actual reads. Reasons that describe reads the module does not have, or that would equally justify keeping every module, do not classify anything.",
        "Move each configuration assertion displaced by a conversion into tests/test_shipped_workflow_is_valid.py as its module is converted, so no assertion is in flight without a home -- notably the stage-ownership statement currently justifying tests/test_stage_output_ownership.py's place on the list.",
        "Reduce PERMITTED_LIVE_ARTIFACT_READERS to the modules that remain subject readers after the conversion, keeping the both-directions equality assertion intact.",
        "Measure the suite's wall-clock runtime after the conversion and record it beside the before figure (474.49 s / 7:54.84 wall at dcda75d), so the comparison is two measurements."
      ],
      "preserve_behavior": [
        "The builder, StageRef, workflow_stage, build_workflow, materialize_workflow and the configured_workflow fixture seam in tests/conftest.py, which verify as sound: they resolve nothing shipped, omit every key not asked for, and produce a definition a real coordinator loads and runs to completion.",
        "The widened live-artifact scan in tests/test_baseline_honesty.py, its helper route, its planted-helper-route control, its builder-only negative control and the both-directions equality assertion.",
        "tests/test_shipped_workflow_is_valid.py, including its three validator checks, the negative control per validator, and the deployment-change demonstration.",
        "The conversion already landed in tests/test_story_coordinator.py, which derives every stage, artifact and category name from the definition it builds.",
        "The five rules already in tests/test_baseline_honesty.py, their present behaviour and their present controls.",
        "Everything this repository ships: workflows/, rules/, prompts/, schemas/, orchestration/, scripts/, .harness/config.yaml and .harness/stories/ are unchanged and stay unchanged."
      ],
      "retry_scope": [
        "tests/"
      ]
    }
  },
  {
    "attempt": 2,
    "blocking_issues": [
      {
        "severity": "high",
        "issue": "The conversion is still incomplete: 3 modules converted, 17 declared as unconverted input readers. The retry converted the two modules the previous finding named -- tests/test_self_routing_retry.py (WORKFLOW = conftest.build_workflow(...) at line 140, four stages assembled from arguments, every name derived from it) and tests/test_retry_routing.py (build_workflow at line 98) -- and both now drive real runs against conftest.materialize_workflow roots. That part is done and verified. But the story's task 'Convert each input reader to a workflow it builds for itself' and technical_plan.likely_file_changes name roughly twenty-four tester modules, and the remaining seventeen were not converted; they were instead recorded in a new set WORKFLOW_INPUT_READERS_AWAITING_CONVERSION (tests/test_baseline_honesty.py:2335-2353), which the module's own comment calls 'the remaining work'. Declaring the debt is honest and the both-directions equality assertion (test_the_modules_reading_the_shipped_workflow_are_exactly_the_classified_ones) makes it survive, but it is not the conversion, and it leaves acceptance criterion 7 unsatisfiable: PERMITTED_LIVE_ARTIFACT_READERS still carries seventeen modules whose shipped-workflow read the suite itself classifies as an input.",
        "location": "tests/test_baseline_honesty.py:2335-2353 and the seventeen modules it names",
        "required_behavior": "Each module in WORKFLOW_INPUT_READERS_AWAITING_CONVERSION is converted to a workflow it builds through conftest.build_workflow / materialize_workflow, keeping every assertion's subject and strength, with each displaced configuration assertion moved into tests/test_shipped_workflow_is_valid.py -- so the set empties and PERMITTED_LIVE_ARTIFACT_READERS names only modules whose reads are subjects."
      },
      {
        "severity": "high",